Code,Title,Date,Views,Text,Tags
9352,Университет ИТМО — первый по компьютерным наукам в России по результатам нового рейтинга АЦ «Эксперт»,"20 Апреля 2020, 10:01",9088,"В этом году предметная линейка была расширена до 16 областей. Университет ИТМО представлен в 14 из 16 предметных рейтингов, за исключением областей «Искусство и гуманитарные науки» и «Науки о Земле», а также во всех пяти предметных срезах: «Металлургия», «Биохимия», «Искусственный интеллект», «Аппаратное обеспечение и архитектура», «Безопасность, риск, надежность и качество». Как и в прошлом году , Университет ИТМО занял первое место по компьютерным наукам и в срезе «Аппаратное обеспечение и архитектура». В другом срезе в рамках компьютерных наук — «Искусственный интеллект» — ИТМО занял второе место. Также петербургский вуз сохранил за собой второе место по инженерным наукам и материаловедению. При этом в новом инженерном срезе «Безопасность, риски, надежность и качество» Университет ИТМО стал лучшим среди российских вузов. Заметны успехи и в «непрофильных» для вуза областях — социальных науках: второй год подряд ИТМО занимает третье место по «Бизнесу и менеджменту». Новым трендом стал рост рейтинговых позиций в области наук о жизни: биохимии, генетики и молекулярной биологии — в них ИТМО занял четвертое и пятое место. Согласно результатам рейтинга, первый неклассический делит третью и четвертую позиции с МГУ по химии при очень небольшой разнице в баллах с лидерами рейтинга — НГУ и СПбГУ. Фото: ITMO.NEWS Рейтинг научной продуктивности от АЦ «Эксперт» строится на двух принципах: объективность (расчеты основаны на открытых данных и легко проверяемы) и специализация именно на анализе научных публикаций вуза. Это отличает рейтинг от других международных и российских исследований, которые используют более комплексный (а подчас весьма субъективный) подход к оценке вузов. При этом составители рейтинга уделяют в методологии большее внимание именно оценке качества публикаций. Публикационная деятельность вузов оценивается по трем равнозначным критериям. Критерий масштаба и устойчивости деятельности описывает долю публикаций университета в определенной предметной области и научный потенциал его коллектива по индексу Хирша. Критерий востребованности публикаций оценивает среднюю цитируемость научных работ и качество журналов, в которых они были опубликованы. Показатель качества роста введен для борьбы с подтасовкой данных и (как отмечают сами составители рейтинга) «для нейтрализации не совсем чистых практик»: он рассчитывает долю самоцитат в общем объеме цитирований и оценивает, насколько широк круг журналов, в которых вуз представляет результаты исследований. « ИТМО представлен в рейтинге, в том на числе лидирующих позициях, в таких еще недавно непрофильных и несвойственных для его научного профиля областях, как “Менеджмент” (третья позиция в рейтинге), “Химия” (третья-четвертая позиция в рейтинге), а в ряде других предметов — “Науки о жизни”, в том числе в срезах “Биохимия”, “Социальные науки”, “Математика” и “Медицина” — в последние годы присутствует заметная положительная динамика в рейтинге. Именно качество научной деятельности и публикаций подтверждает лидерство ИТМО в компьютерных и инженерных науках, в материаловедении, а также в более узких предметных срезах. Максимальный или близкий к максимальному балл ИТМО имеет в ряде предметов по блоку “Востребованность научной деятельности”, который включает в себя оценку цитирования научных публикаций и качества журналов », — комментирует Илья Куфтырёв , директор Центра рейтинговых исследований Университета ИТМО. Фото: ITMO.NEWS Помимо рейтинга научной продуктивности АЦ «Эксперт» также готовит рейтинг изобретательской активности университетов — лидеров по практической реализации своих разработок. Он формируется на основе патентных баз PatentLens, Google Patents и ФИПС/Роспатент. В новом издании рейтинга Университет ИТМО продемонстрировал серьезный рост своей патентной активности — в этом году он занял седьмое место, поднявшись в рейтинге сразу на десять позиций благодаря наличию в этом году проданных патентов и цитирования патентами статей университета. Подробнее ознакомиться с результатами можно в таблице : Рейтинги публикационной и изобретательской активности российских университетов-2020.xlsx К началу","Рейтинг, Главное, Computer science, Рейтинги, Патенты, Эксперт, Аналитический центр ""Эксперт"", Научная продуктивность"
9337,Университет ИТМО и «Яндекс» запускают новую магистерскую программу «Аналитика данных»,"14 Апреля 2020, 13:53",21464,"Работа с данными сегодня является одной из самых востребованных специализаций в мире IT: обработка больших массивов информации необходима компаниям, работающим практически во всех отраслях современной экономики. Онлайн-переводчики, составление маршрутов транспорта, создание новых материалов, разработка современного ПО, умные камеры, распознающие лица — все это было бы невозможно без анализа данных и машинного обучения. Все чаще большие данные востребованы и в науке — с их помощью расшифровывают геномы, исследуют новые молекулы, анализируют творческое наследие писателей прошлого. В условиях продолжающегося роста потребности в таких специалистах Высшая школа цифровой культуры Университета ИТМО и компания «Яндекс» открыли в вузе новую совместную магистерскую программу « Аналитика данных ». « Мы видим, что потребность в этих специалистах только растет, поэтому совместно с ИТМО запустили магистерскую программу, где будем помогать готовить студентов к вызовам современной IT-индустрии. У Яндекса большой опыт в создании образовательных проектов, как самостоятельных, например, Школа анализа данных, так и в партнерстве с другими университетами », — комментирует Евгения Куликова , руководитель службы академических программ Яндекса. Фото: ITMO.NEWS Структура программы В первом наборе на программу сможет поступить 21 человек: 16 — на бюджетные места, еще 5 — на контрактные. Программа обучения будет рассчитана на тех, кто окончил бакалавриат по компьютерным или математическим специальностям и имеет навыки программирования. В течение двух лет студенты будут изучать математические основы работы с данными, практиковаться в использовании алгоритмов обработки и хранения информации, а также в модификации этих алгоритмов для получения лучших результатов. Обучение будет вестись по двум специализациям: методы анализа данных (направлена на разработку новых методов/инструментов для анализа данных); технологии анализа данных (направлена на применение/адаптацию существующих методов к различным предметным областям). Фото: ITMO.NEWS В ходе обучения магистранты будут изучать такие дисциплины, как технологии программирования, машинное обучение, обработка изображений, обработка речи, теория вероятности и математическая статистика, обработка естественного языка. В настоящее время аналитика данных требуется практически во всех предметных областях — в различных сферах производства, в рекламе, коммерции, в образовании. Проектирование данных и организация их хранения, обработка Big Data, выводы и решения на основе данных, а также прогнозирование, построение отчетности и многофакторная визуализация — все это востребовано современным рынком труда, добавляет Елена Михайлова , руководитель новой программы, директор Высшей школы цифровой культуры Университета ИТМО. Она также отмечает, что при реализации магистерской программы Университет ИТМО планирует сотрудничать с крупными международными и российскими компаниями. « У нас налажены связи со многими IT-компаниями, например, Dell Technologies , SAP , Digital Design . Эти компании готовы с нами взаимодействовать, инициируя студенческие проекты, темы курсовых и выпускных работ, способствовать в организации практики », — рассказывает Елена Михайлова. Елена Михайлова. Фото: ITMO.NEWS Два диплома вместо одного Часть дисциплин будут преподаваться в сотрудничестве с учебным центром компьютерных технологий «Яндекса» в Санкт-Петербурге. Более того, для желающих студентов магистерской программы будет устроен дополнительный набор в этот центр. « В Санкт-Петербурге работает Computer Science Center , открытый по инициативе Яндекс, JetBrains и ПОМИ РАН, где читаются курсы по математике и программированию. Студентом может стать каждый, кто пройдет вступительные испытания. Для студентов нашей программы, как и для других партнеров, в этом центре будет устроен дополнительный набор. Обычно экзамены туда проходят в апреле, однако наши ребята смогут дополнительно сдать экзамены после поступления в магистратуру и обучаться параллельно с учебой в ИТМО. При этом, те дисциплины, которые они будут изучать в Computer Science Center, входят в учебный план магистерской программы. Это даст возможность по окончании магистратуры получить не только диплом Университета ИТМО, но также и диплом Computer Science Center, который очень высоко ценится среди работодателей », — комментирует Елена Михайлова. В результате, как отмечает руководитель программы, после завершения обучения, студенты смогут стать специалистами широкого профиля, совмещающими в себе как навыки программирования, так и знание методов анализа данных в различных предметных областях. Специалисты такого рода смогут работать как в науке, так и в различных высокотехнологичных компаниях, резюмирует она. К началу","Машинное обучение, Магистратура, Технологии, IT, Программирование, Сотрудничество, Яндекс, Главное, Магистерская программа, Аналитика данных"
9334,"Ученые Университета ИТМО создали приложение, показывающее риск заражения COVID-19 в зависимости от поведения людей","13 Апреля 2020, 13:55",14935,"Практически любой человек понимает, что в условиях пандемии сокращение контактов с другими людьми снижает риск заболеть самому и заразить своих близких. И все же полностью отказаться от взаимодействия с внешним миром не получится. Однако человеку хочется понимать, насколько текущие меры самоизоляции защищают общество от распространения эпидемии и каков будет негативный эффект, если от них отступать. Ученые Национального центра когнитивных разработок Университета ИТМО создали Интернет-приложение, которое позволяет прогнозировать распространение инфекции в разных странах. В основе приложения — эпидемиологическая модель, совмещенная с моделью поведения общества; они настраиваются на актуальных данных о количестве заболевших. Источник: msplatform.actcognitive.org Приложение позволяет в игровой форме оценить, как усиление или ослабление мер самоизоляции в конкретной стране может повлиять на риски распространения инфекции. Это дает возможность пользователю судить, как его собственные действия влияют на риск попасть в число зараженных. « Современные эпидемиологические модели должны строиться не только и не столько на основе медицинских данных, а на основе данных о социальных связях, — рассказывает руководитель лаборатории Национального центра когнитивных разработок Университета ИТМО Сергей Иванов . — Чтобы показать это обычному пользователю, мы создали приложение, где люди могут наглядно увидеть, что будет, если они станут небрежно относиться к мерам самоизоляции. В основе модели — учет разных видов социальных контактов, включая массовые мероприятия, профессиональную деятельность, бытовую мобильность, а также контакты внутри семей ». Эпоха COVID-19 Видео: пример мультиагентного моделирования потоков людей в местах вынужденного скопления. Источник: actcognitive.org Как подчеркивают ученые, создание приложения — это лишь демонстрационная часть большой работы по математическому моделированию в условиях пандемии. Свои исследования они хотят использовать как для помощи простым людям, так и для поддержки принятия решений властями, руководителями заводов, сетей городского транспорта, магазинов и других мест скопления людей. « Наша команда занимается моделированием повседневного поведения людей в городе, мы понимаем, как выглядит поведение человека в транспорте, магазине, на работе , — поясняет директор Национального центра когнитивных разработок Университета ИТМО Александр Бухановский . — В этой ситуации мы имеем возможность строить контактные сети, смотреть их динамику и использовать свои знания о контактах, чтобы понять, что нужно сделать, чтобы эпидемия шла медленнее — например, стоит ли закрывать метро, или это незначительно повлияет на глобальный риск распространения заболевания. Мы работаем над возможностью построения моделей, которые могли бы гибко настраиваться в зависимости от изменения входных данных, связанных не только с динамикой эпидемиологической обстановки, но и теми факторами, которые контролируются не столь явно, например, ""завозными"" случаями из других городов, действиями супер-распространителей и так далее ». Александр Бухановский. Фото: ITMO.NEWS Исследователи работают над созданием информационной технологии, позволяющей составлять расписание транспорта и организовать движение людей в местах их вынужденного скопления так, чтобы риск распространения болезни был минимален, и при этом максимально сохранялся бы комфорт людей. Также ученые рассматривают возможность организации сервиса взаимодействия граждан и малого бизнеса в условиях социальной изоляции. К началу","Высокопроизводительные вычисления, Приложение, Главное, САЕ IT, Компьютерное моделирование, МН IT, НЦКР, COVID-19, Модели, Эпидемиологическая модель"
