Code,Title,Date,Views,Text,Tags
7245,"Олимпиада «ИТМО ВКонтакте»: заработать до 10 баллов к ЕГЭ, не выходя из соцсети","18 Января 2018, 11:46",18932,"Как участвовать Чтобы принять участие в соревновании, школьникам необходимо вступить в официальное сообщество олимпиады, ввести регистрационные данные в специальном приложении и после публикации заданий приступить к их выполнению. На выполнение этой задачи организаторы отвели участникам больше месяца: заочный этап олимпиады пройдет с 12 февраля по 12 марта . Сразу за заочным этапом последует очный тур , который пройдет с 6 по 8 апреля . Чтобы принять участие в очном туре, старшеклассники, прошедшие в финал, приедут в Университет ИТМО в Санкт-Петербург. Порядок проведения заочного и очного туров Все взаимодействия в рамках олимпиады проводятся только через сообщения в социальной сети, что, как показывает практика, привычно и удобно пользователям. В этом году в список предметов, по которым вуз проводит состязания, вошли шесть дисциплин: математика, физика, химия, обществознание, английский язык и информатика. Особенность олимпиады в том, что школьник может принять участие по всем дисциплинам в заочном туре. На этом этапе на тестирование по каждому предмету участнику отводится один час, в очном туре общее время, отведенное на олимпиаду, составляет шесть часов, при этом на одну дисциплину выделено не больше двух часов. Выбор в пользу сразу нескольких предметных областей олимпиады значительно влияет на итоговые результаты, однако участника важно правильно рассчитать время и свои силы. «Для составления олимпиадных заданий мы привлекли предметные комиссии, в состав которых вошли сотрудники Университета ИТМО. На данном этапе задания для заочного тестирования уже составлены, а состязания для очного тура сейчас на этапе утверждения организаторами. Известно, что в финале по английскому языку старшеклассников ожидают тестовая часть и аудирование, по информатике каждый участник пройдет тестирование и продемонстрирует навыки программирования, в остальных дисциплинах ребят ожидает решение задач», – рассказал ответственный секретарь Приемной комиссии Университета ИТМО Алексей Итин . Очный тур олимпиады «ИТМО ВКонтакте» 2017 года Особенности олимпиады «ВКонтакте»-2018: образовательная площадка и тревел-гранты В этом году условия проведения олимпиады все же несколько изменились. Так, соревнование проводится с использованием новой образовательной площадки . Также увеличилось число тревел-грантов от Ассоциации выпускников ИТМО для участников очного тура – они покрывают стоимость проезда в обе стороны и проживание в Санкт-Петербурге во время очного этапа. В прошлом году тревел-грантами могли воспользоваться только два человека, а в этом году количество счастливчиков выросло в пять раз: в Северную столицу на безвозмездной основе приедут до десяти человек, набравших максимально высокие баллы по результатам заочного этапа. На принятие решения о присуждении грантов повлияет и количество дисциплин, в которых примет участие школьник: чем в больших предметах он преуспеет, тем больше шансов у него получить тревел-грант. Для тех, кто пройдет в очный этап, помимо дней, отведенных для участия в олимпиаде, предусмотрены и дни отдыха в городе, во время которых школьники смогут увидеть достопримечательности Санкт-Петербурга, посетить научные лаборатории Университета ИТМО, а также прослушать научно-популярные лекции. Так, представитель Университета ИТМО и представитель «ВКонтакте» расскажут о новых технологиях, применяемых в науке и в работе самой масштабной российской социальной сети. Те, кто отправится в Санкт-Петербург без тревел-гранта, могут рассчитывать на хорошую скидку в одном из отелей города. Также в этом году социальная сеть «ВКонтакте» разыграет 50 билетов на летний фестиваль «ВКонтакте» – количество подарочных билетов превышает прошлогоднее число в пять раз. Также среди призов – шлемы виртуальной реальности и фирменная продукция от ITMO.STORE . Анна Веклич «Новая роль университета состоит в том, чтобы искать и обеспечивать баланс физической и виртуальной реальности, в которой “живут” современные школьники. Безусловно, Университет ИТМО заинтересован в том, чтобы приглашать к себе лучших. Но не всегда баллы ЕГЭ являются показателем той самой мотивации, стремления и таланта, поэтому в нашем университете мы ежегодно организуем более 20 проектов для школьников, победители которых получают дополнительные баллы к ЕГЭ при поступлении к нам. Олимпиада “ИТМО ВКонтакте” один из таких проектов, созданный совместно с социальной сетью, которую знают и любят во всем мире. Нам важно помочь ребятам сделать правильный выбор на пути к своей мечте – например, выбрать именно Петербург для своего дальнейшего обучения после школы» , – говорит Анна Веклич , первый заместитель председателя Приемной комиссии Университета ИТМО. Статистика прошлого года В 2017 году в олимпиаде в отборочном туре олимпиады приняли участие 2203 участника, в этом году ожидается не менее 3 000 участников. Самыми популярными среди учеников стали олимпиады по информатике (27.7%) и математике (31.6%) – профильные предметы для поступления в Университет ИТМО. Остальные предметы распределились следующим образом: обществознание – 13%, физика – 11%, английский язык – 13.9% и химия – 2.8%. Также победителями олимпиады 2017 года стали 81 участник, 35 из которых поступили в Университет ИТМО, воспользовавшись дополнительно заработанными в рамках олимпиады баллами. Также известно, что количество абитуриентов, которые сегодня используют диплом предметной олимпиады школьников Университета ИТМО для получения дополнительных баллов при поступлении, составляет около 15%. Победители олимпиады в 2017 году Напомним, что  Университет ИТМО неоднократно был одним из первых российских вузов, использующих новые коммуникационные инструменты: завел официальные страницы во « ВКонтакте » и Facebook , корпоративный блог на Хабрахабре , подготовил курсы для платформ онлайн-образования, среди которых edX , создал системы проведения дистанционных вступительных испытаний для поступающих в магистратуру и аспирантуру , интернет-магазин корпоративной атрибутики ITMO.STORE . Список каналов взаимодействия с талантливыми школьниками и студентами, учеными, зарубежными партнерами вуз будет постоянно расширять. Подробнее про олимпиаду можно узнать в ее официальном сообществе . К началу","Олимпиада, ВКонтакте, Главное, Абитуриент, ИТМО ВКонтакте, Поступление-2018, Социальная сеть"
