Code,Title,Date,Views,Text,Tags
6053,Мегагранты-2016: Университет ИТМО получит 90 млн рублей на развитие гибридных материалов для нового поколения оптоэлектроники,"28 Сентября 2016, 12:03",,"Как поясняет Сергей Макаров , в современной нанофотонике появилась тенденция исследовать новые материалы для создания так называемых метаматериалов, обладающих свойствами, не встречающимися в природе. Например, основой многих материалов ранее были золотые наночастицы. Однако сейчас в ведущих научных центрах США основой для них становятся нитриды металлов, а в Австралии вместо золота активно используют кремний. Разработки, которыми займутся в новой лаборатории, будут основаны уже на органо-неорганических (гибридных) компонентах. В будущем, благодаря своим свойствам, они смогут существенно повлиять на развитие оптоэлектронных технологий и всевозможных гаджетов нового поколения. Так, специалисты планируют модернизировать прорывную технологию гибридных перовскитов, эффективно преобразующих свет в электрический ток и наоборот, за счет соединения их с концепцией метаматериалов. Это позволит им повысить эффективность солнечных батарей и светодиодов. Кроме того, благодаря большому потенциалу перовскитов с точки зрения эффективности и простоте их создания, окупаемость оптоэлектронных устройств на их основе лучше, чем у полупроводниковых аналогов. Так что, по смелым прогнозам ученых, на смену современным смартфонам и планшетам придут компактные и высокоэффективные оптические устройства на основе метаматериалов и новых гибридных структур. « Эти материалы очень нужны, так как нам необходимо делать ставку на новые источники энергии — особенно на солнечную энергию. Ведь нефтяные запасы не бесконечны. Кроме того, перовскиты, совмещенные с метаматериалами, в будущем будут использоваться в качестве высокоэффективных светодиодов на гибких основах. Так что я абсолютно уверен, что наша лаборатория станет центром притяжения лучших исследователей в области оптоэлектроники со всего мира» , — подчеркивает Сергей Макаров. Университет ИТМО. Пресс-конференция в ТАСС Как отмечает руководитель Международного научно-исследовательского центра нанофотоники и метаматериалов Павел Белов , ученым следует воспринимать получение мегагранта как вливание инвестиций в научный стартап. По его мнению, наибольшая польза от таких средств наблюдается, если их вкладывать в талантливых исследователей. Эту гипотезу подтвердило и пятилетнее развитие Международного научно-исследовательского центра нанофотоники и метаматериалов, количество сотрудников в котором в данное время составляет 160 человек. Отметим, что Центр вырос из лаборатории, созданной на выигранные Университетом ИТМО в первую волну мегагрантов средства. « Концепция стартапа работает: мы смогли купить оборудование, привлечь ребят, которые пришли к нам работать. Нам очень повезло, что три года назад Проект 5−100 тоже сыграл свою роль в нашем развитии после окончания финансирования по первому мегагранту 2010 года. Так что теперь мы развиваем крупную международную коллаборацию в области прорывных метаматериалов» , — добавил Павел Белов. Отметим, что Университет ИТМО также выиграл мегагрант на создание лаборатории «Гибридные состояния света в веществе в низкоразмерных квантовых материалах с заданными характеристиками». Соруководителем с российской стороны выступит главный научный сотрудник кафедры нанофотоники и метаматериалов Иван Шелых . Уточненная информация по этому проекту появится позже. За последние шесть лет Университет ИТМО стал обладателем шести мегагрантов. В настоящее время на средства, выделенные на конкурсной основе Министерством образования и науки, в вузе развиваются суперкомпьютерные и грид-технологии, технологии взаимодействия хиральных нанокристаллов и биосистем, а также адаптивные системы управления, коммуникации и вычисления. К началу","Метаматериалы, Нанофотоника, Мегагрант, Главное, Гибридные структуры"
6052,Тинькофф Банк учредил именную стипендию для двукратного чемпиона мира по программированию из Университета ИТМО,"27 Сентября 2016, 21:11",,"«Молодые люди должны учиться и думать о знаниях, а не о деньгах. Поэтому мы готовы поддерживать лучших студентов, в том числе и финансово, и надеемся, что эта стипендия станет хорошим стимулом для других. А самых талантливых разработчиков и программистов после вуза мы приглашаем в команду „Тинькофф“!» , — подчеркнул Олег Тиньков . В рамках кампании по поиску лучших IT-специалистов Тинькофф Банк проводит встречи со студентами вузов России. В апреле этого года Олег Тиньков встретился со студентами Университета ИТМО, где в формате вопрос-ответ рассказал о себе, своем деле и обсудил вопросы социальной ответственности бизнеса. После встречи предприниматель объявил о готовности Тинькофф Банка выплачивать ежемесячную стипендию студенту, который достиг значительных успехов в сфере IT не только в России, но и в мире. Таковым стал Геннадий Короткевич, магистрант Университета ИТМО, двукратный чемпион ACM ICPC и целого ряда значимых для мира информационных технологий соревнований. «Сейчас за таланты идет всемирная битва не только между университетами, но и между ведущими IT-компаниями мира, — отметил заведующий кафедрой технологии программирования Университета ИТМО Анатолий Шалыто . — Наша кафедра и вуз выступают за сохранение в университете лучших студентов, чтобы они впоследствии могли передавать свои знания таким же талантливым ребятам. Нам помогали и помогают наши знаменитые выпускники, а также компании JetBrains, Яндекс, Mail.Ru, Devino Telecom, „Транзас“. Благодаря этому на кафедре „Компьютерные технологии“ на постоянной основе работают трое чемпионов мира по программированию — Павел Маврин, Максим Буздалов и Артем Васильев, призеры чемпионатов мира Георгий Корнеев и Андрей Станкевич — тренер, обеспечивший шесть побед команд Университета ИТМО на одном из самых престижных чемпионатов мира по программированию ACM ICPC. Многосторонняя помощь позволяет студентам и преподавателям кафедры достигать результатов мирового уровня. Мы рады, что число партнеров, которые нас поддерживают, пополнилось Тинькофф Банком во главе с Олегом Тиньковым». Напомним, что Геннадий Короткевич с 2008 по 2012 год завоевывал золотые медали на международной олимпиаде школьников по информатике, трижды становился абсолютным победителем соревнования. Будучи студентом Университета ИТМО, Геннадий — дважды чемпион Facebook Hacker Cup, трижды — победитель Google Code Jam уже три года подряд. Кроме того, молодой человек побеждал в 2014 и 2016 году на Russian Code Cup, а также в Яндекс. Алгоритм — в 2010, 2013, 2014, 2015 годах. В 2013 и 2015 годах Геннадий Короткевич в составе команды Университета ИТМО стал чемпионом международной студенческой олимпиады по программированию ACM ICPC. В этом году он окончил бакалавриат и поступил в магистратуру Университета ИТМО. К началу","Стипендия, Главное, Тинькофф банк"
6051,Два проекта Университета ИТМО будут представлять Россию на Всемирной олимпиаде по робототехнике в Нью-Дели,"27 Сентября 2016, 18:52",,"Всемирная олимпиада по робототехнике (World Robot Olympiad) проводится с 2004 года — сейчас к международному соревнованию присоединились порядка 54 стран. Ежегодно кочующая по разным странам WRO собирает более 1500 талантливых школьников в возрасте от 10 до 21 лет. Олимпиада подразумевает соревнования роботов, собранных из наборов LEGO, в трех категориях — основной, творческой и среди роботов-футболистов. Первые две категории делятся на возрастные группы и, как правило, подчиняются заданной организаторами теме. Так, в этом году слоганом Всемирной олимпиады стала фраза «Rap the scrap!», а главной темой — создание роботов для сортировки, переработки и сбора мусора. Всероссийская робототехническая олимпиада. Личный архив Молодежный центр робототехники при мегафакультете компьютерных технологий и управления Университета ИТМО вышел в финал олимпиады с двумя проектами: «Чистая Арктика» и «Роборука». С первым проектом команда школьников под руководством тренера, сотрудника кафедры систем управления и информатики Игоря Лосицкого стала победителем Всероссийской робототехнической олимпиады в средней возрастной группе в творческой категории. Робот нацелен решить одну из важных экологических проблем, связанных с избавлением Арктики от пустых бочек из-под горюче-смазочных материалов, которые на данный момент никоим образом не утилизируются и не вывозятся. Разработанный школьниками помощник определяет местонахождение бочек, подбирает их и перевозит на конвейер, который транспортирует бочки под пресс. Сплющенные металлически «блины» проще складировать и вывозить на Большую землю. Данный проект также был высоко оценен на фестивале « Робофинист », который прошел в Санкт-Петербурге в эти выходные. Зрелищная модель робота, который собирает жестяные банки, имитирующие баки из-под горючего, и отправляет мусор в плавание на корабле, заслужила первое место в свободной творческой категории, средней возрастной группы. Второй проект, который также разработан на базе Молодежного центра робототехники в Университете ИТМО, подразумевает создание робота-манипулятора, подобного человеческой руке. Причем контроль такого робота производится с помощью 3D-сенсора, что подразумевает бесконтактный способ считывания положения рук человека. Чтобы управлять таким роботом, человеку будет достаточно поднести руку в определенное место на стенде — 3D-сенсор «считает» движения кисти и пальцев и передаст сигнал роборуке. Данный робот будет бесценен при выполнении работ в опасных для человека средах, где необходима цепкость и маневренность руки. Пользоваться таким устройством сможет любой специалист без предварительного обучения работы на нем. Игорь Лосицкий, Александр Капитонов и Илья Широколобов. Источник: личный архив Вместе с проектами Молодежного центра робототехники на WRO-2016 выступят московские школьники из ГБОУ СОШ № 354 им. Д. М. Карбышева с проектом Rustechno и учащиеся президентского физико-математического лицей № 239 с роботом, который собирает мусор, дрейфующий в океане. Добавим, что традиционно российские команды показывают высокие результаты на соревновании. Так, в 2015 году школьники из России заняли четыре призовых места. К началу","Олимпиада, Робототехника, Главное, WRO-2016, Творчество, МН Робототехника"
