Code,Title,Date,Views,Text,Tags
5893,Университеты ИТМО и КАИ запускают первую в стране многоузловую квантовую сеть,"8 Августа 2016, 00:00",,"Сегодня защита каналов связи основана на использовании специализированных математических алгоритмов. Однако логику любого, даже самого сложного алгоритма рано или поздно можно «раскусить». По этой причине ученые по всему миру работают над созданием систем квантовой коммуникации — метода защищённого информационного обмена, основанного на фундаментальных законах квантовой физики. Такой подход делает линии связи практически неуязвимыми для хакерских атак: в качестве носителей информации выступают одиночные фотоны, которые необратимо изменяются при попытке перехвата данных, благодаря чему пользователи моментально узнают о любом вторжении в канал. Системы квантовых коммуникаций лягут в основу инфраструктуры сетевой безопасности нового поколения, которая будет востребована всеми субъектами, использующими конфиденциальный обмен информацией: финансовыми структурами, государственными ведомствами, промышленными предприятиями. В перспективе квантовые коммуникации будут интегрироваться в концепцию «Интернета вещей». В рамках проекта Казанской квантовой сети впервые в российской практике квантовым каналом будут объединены четыре узла, расположенные на расстоянии 30−40 км друг от друга. На данный момент в Казани запущен первый участок сети, соединивший два корпуса КНИТУ-КАИ. В пилотном сегменте достигнута скорость генерации просеянных квантовых последовательностей 117 кбит/c на линии протяжённостью 2,5 км — на порядок быстрее, чем в европейских сетевых проектах в области квантовой связи. В ходе экспериментов была успешно продемонстрирована передача квантовых бит в оптическом канале с потерями 20 дБ, что эквивалентно расстоянию 100 км. Важно отметить, что казанский проект реализуется на действующей оптоволоконной линии с использованием телекоммуникационной инфраструктуры оператора ПАО «Таттелеком». Университет ИТМО. Артур Глейм «Создаваемая сеть — это пилотный проект, главная задача которого — „полевые испытания“: тестирование технологии, отработка механизмов интеграции квантовых каналов в существующую телекоммуникационную инфраструктуру и масштабирования квантовой сети. Все это осуществляется на реальных местах пользования и на базе работающих городских линий связи, — поясняет руководитель Лаборатории квантовой информатики Международного института фотоники и оптоинформатики Университета ИТМО и лаборатории практической квантовой криптографии Казанского квантового центра Артур Глейм . — Для нашей страны это важнейший шаг в развитии квантовых систем сложной конфигурации и топологии, адаптированных под потребности операторов связи и конечных пользователей». Директор Казанского квантового центра КНИТУ-КАИ Сергей Моисеев , в свою очередь, отмечает, что создаваемая в Казани сеть основана исключительно на оригинальных разработках российских ученых — от самого подхода до технического воплощения. «Таких проектов в мире единицы, поскольку их способны реализовать только ведущие научные центры, обладающие передовыми знаниями в области как фотоники и квантовой информатики, так и сетевых информационных технологий, в тесном взаимодействии с индустриальными партнерами, — комментирует он. —  По своим параметрам наша сеть сопоставима с прогрессивными международными аналогами, а по ряду характеристик и превосходит их». До сих пор в России в городских условиях действовали лишь линии квантовой связи, организованные по принципу «точка-точка». Первая в стране линия была запущена Университетом ИТМО в Санкт-Петербурге в 2014 году — она объединила два корпуса вуза по подземному оптоволоконному кабелю. В 2016 году в прессе появились сообщения о проведении Российским квантовым центром сеанса квантовой связи между двумя банковскими офисами в Москве. Оборудование Лаборатории квантовой информатики Университета ИТМО По словам Артура Глейма, развитие инфраструктуры квантовых коммуникаций сегодня можно сравнить с тем, как развивался российский Интернет во времена проекта RUNNet: запуск пилотных участков, связывающих между собой университеты, приведет к взрывному росту технологий и формированию новых рынков, на базе которых вырастет отечественная инфраструктура связи нового поколения. Ожидается, что на горизонте 5−10 лет технология квантовой коммуникации окончательно выйдет из лаборатории и станет такой же привычной и полезной частью нашей жизни, как широкополосный интернет и мобильная связь. Проект Казанской квантовой сети реализуется в рамках Национальной технологической инициативы, при поддержке Консорциума в области квантовых технологий по направлению SafeNet , ориентированному на развитие новых персональных систем сетевой безопасности и квантовых коммуникаций в России. К началу","Фотоника, НТИ, Квантовые_коммуникации, SafeNet, Квантовая_сеть, Главное, НИУ ИТМО"
5891,Геннадий Короткевич — трижды чемпион Google Code Jam,"6 Августа 2016, 00:00",,"Двукратный чемпион ACM ICPC Геннадий Короткевич подтвердил свой действующий титул победителя Google Code Jam, набрав 170 баллов из 200 возможных. Второе место занял филиппинец Кевин Сого , третьим оказался сотрудник Devexperts Егор Куликов , который неделю назад стал победителем турнира Яндекс.Алгоритм. Евгений Капун (чемпион ACM ICPC 2009, 2012, выпускник Университета ИТМО) стал четвертым, отстав от бронзового призера на десять баллов (110 баллов). Студент Уральского федерального университета и серебряный медалист ACM ICPC 2016 Олег Меркурьев стал пятым. Аспирант ННГУ Влад Епифанов, медалист ACM ICPC 2011 и 2016 годов занял 12-е место. Кроме того, достойно выступили выпускник и преподаватель Университета ИТМО, чемпион ACM ICPC 2004 Павел Маврин и студент ННГУ и медалист ACM ICPC 2016 Николай Калинин , заняв 13-е и 14 -е места соответственно. «Неожиданно, но мой отрыв от второго места оказался весьма значительным — 50 баллов из 200. Так, например, можно было бы совсем не решать самую сложную задачу E и при этом остаться на первом месте. В этой задаче предлагалось найти маршрут из точки старта в точку финиша на плоскости, на которой есть одна или две точки, излучающие радиацию. Разумеется, в ходе маршрута нужно было получить как можно меньше излучения», — рассказывает Геннадий Короткевич. Google Code Jam 2016. Источник: социальные сети Основным отличием Google Code Jam от других чемпионатов является то, что в каждой из предложенных задач баллы начисляются за их «простые» и «сложные» версии. Так, в простой версии задачи, кроме меньших ограничений в условии, система дает мгновенный отчет о том, является ли правильным загруженный участником ответ. У финалиста, в свою очередь, есть возможность исправить ошибки и отправить новое решение повторно. Однако для отправки сложной части задачи есть лишь одна попытка, результат которой остается интригой для всех участников вплоть до церемонии награждения, поясняет тьютор кафедры компьютерных технологий Лидия Перовская. Добавим, что соревнования Google Code Jam ведут свою историю с 2003 года. В настоящее время 25 финалистов отбираются посредством нескольких раундов из десятков тысяч участников, имеющих Google-аккаунт и изначально зарегистрированных в квалификационном туре. Победитель получает возможность трудоустройства в компанию и 15 тысяч долларов призовых, а также автоматически попадает в финал следующего Google Code Jam. Полина Полещук , Редакция новостного портала Университета ИТМО К началу","Google Code Jam, Программисты, Геннадий_Короткевич, Главное, Достижения"
