Code,Title,Date,Views,Text,Tags
10335,"«Ты нужен людям!» — в восьми карточках рассказываем о том, как устроено волонтерство в Университете ИТМО","14 Мая 2021, 12:36",19705,"По пунктам: Зачем мне это надо — тратить свое время на помощь кому-то? Разве этим не должно заниматься государство? Труд волонтеров как-то оплачивается? А кому нужно помогать? Как устроена работа волонтеров в ИТМО А если я не могу постоянно заниматься волонтерством, а хочу помогать только время от времени? Волонтером может быть любой? Или есть какие-то строгие требования? А есть ли у волонтеров «карьерный рост»? Как можно записаться в Добровольческий центр? 1. Зачем мне это надо — тратить свое время на помощь кому-то? Разве этим не должно заниматься государство? Волонтерская деятельность открывает перспективы роста в плане навыков, связанных с организаторскими способностями. Также это шанс применить и прокачать свои профессиональные навыки, например, как в цифровом волонтерстве. Кроме того, это возможность увидеть изнутри мероприятия от вузовского до международного уровня, а еще — возможность менять мир вокруг. 2. Труд волонтеров как-то оплачивается? Труд волонтеров обычно не оплачивается, но он дает множество других бонусов, например, возможность ездить на форумы, стажировки и волонтерские лагеря — в том числе, за рубеж. А еще это можно принимать непосредственное участие в мероприятиях мирового масштаба, таких как Чемпионат мира по футболу, Олимпийские игры, Формула-1. Также активные участники волонтерского движения могут придумывать и создавать собственные социальные проекты, участвовать в грантовых конкурсах и получать финансирование. 3. А кому нужно помогать? На данный момент в Университете ИТМО девять добровольческих клубов и, соответственно, девять направлений работы волонтеров. Событийное волонтерство на различных мероприятиях от вузовского до международного уровня (в том числе VK Fest, Geek Picnic) Помощь приютам для животных (например, сбор кормов, дрессировка собак, организация сбора средств) Работа с детьми в больницах и в детских домах (проведение мастер-классов, спектаклей и праздников) Экологическое волонтерство (экошкола Ecohabits, внедрение раздельного сбора мусора и сбор макулатуры, международный волонтерский экологический лагерь с участием иностранных волонтеров из более 20 стран) Донорство крови и костного мозга Сохранение культурного наследия (музейное волонтерство и участие в реставрационных работах) Работа с ветеранами (например, участие в мероприятиях, связанных с Днем победы) Помощь пожилым людям в освоении цифровых технологий (смартфона, компьютера и так далее) Цифровое волонтерство (помощь в организации дистанционного обучения и онлайн-мероприятий) 4. Как устроена работа волонтеров в ИТМО? Если говорить о добровольческих клубах, то большинство мероприятий они придумывают сами. Часто к сотрудникам Добровольческого центра приходят партнеры с запросом о помощи или предложением о реализации совместного мероприятия. Но в большинстве случае все-таки инициатива идет от студентов, а сотрудники Центра помогают им воплощать даже самые безумные идеи в жизнь. Многие состоят сразу в нескольких добровольческих направлениях и очень дружат. Помимо руководителей клубов есть тим-лидеры (координаторы) волонтерских групп на мероприятиях — часто из этих ребят и вырастают руководители клубов. У Центра есть свои традиции, и одна из них неизменна: мы всегда летом по завершению сезона идем на волонтерские шашлыки. 5. А если я не могу постоянно заниматься волонтерством, а хочу помогать только время от времени? Время от времени можно помогать во многих направлениях, причем не только в событийном волонтерстве. Например, в приюты для животных можно ездить раз или два в месяц. А можно просто участвовать в раздельном сборе мусора — этот вклад так же важен. Но некоторые активности действительно требуют полной вовлеченности — например, наставничество воспитанников детских домов или организация учебных занятий на дистанте. 6. Волонтером может быть любой? Или есть какие-то строгие требования? Волонтером может быть любой человек, даже тот, кому еще не исполнилось 18 лет (тогда требуется согласие родителей). На разных проектах есть разные требования: например, для работы с детьми нужно предварительно пройти собеседование, а для цифрового волонтерства — пройти обучение. 7. А есть ли у волонтеров «карьерный рост»? Да, волонтеры могут становиться тим-лидерами волонтерских групп, создавать и вести собственные проекты. Часто волонтеры находят работу в НКО. Можно принимать участие в различных конкурсах, например, Доброволец России, тиражировать свои проекты в регионы, ездить на тренинги и стажировки. 8. Как можно записаться в Добровольческий центр? Через единый портал добровольческого движения Dobro.ru . Там размещаются все актуальные вакансии и мероприятия, в которых можно поучаствовать. Следить за актуальными новостями также можно на страничке ВКонтакте и на официальном сайте . К началу","Главное, Социальная активность, Волонтерская деятельность, Добровольческий центр"
10334,Стресс как причина депрессии и смещенная активность как противоядие от нее — в лекции биолога Дмитрия Жукова,"14 Мая 2021, 11:20",23932,"Что такое стресс и как он возникает С биологической точки зрения, стресс — это реакция на актуальную новизну: значимый стимул, требующую срочных решений ситуацию. По сути, это приспособительная реакция нашего организма, которая направлена на решение проблемы либо на адаптацию к ситуации. У животных стресс возникает в условиях непосредственной угрозы их жизни, например, при нападении хищника. А у людей основными источниками стресса являются социальные стимулы. В сложных социальных ситуациях — например, при разговоре с начальством — у нас активируется готовность к борьбе или кровопролитию — совсем как у животных. Сужаются сосуды, питающие сердце и мозг, активируются системы свертывания крови, повышается давление — в общем, организм готовится к возможным потерям крови. Конечно же, никакой драки и кровопролития не происходит. Но из-за всех этих запущенных физиологических процессов значительно повышается риск тромбообразования, инсультов, инфарктов, гипертонических кризов и так далее. То есть многие физиологические реакции при стрессе, направленные на выживание, на самом деле вредят нашему организму, потому что никакой непосредственной физической угрозы нет. В то же время умеренные и непродолжительные стрессы очень полезны. Потому что любая физиологическая система работает как на усиление, так и на ослабление: на всякое pro в нашем организме найдется contra. Есть системы, повышающие кровяное давление, и есть системы, понижающие его. Поскольку стресс всегда сопряжен с тревогой, одновременно в организме запускаются механизмы, которые снижают эту тревогу и вызывают, напротив, эйфорию. Поэтому часто люди находятся в постоянном поиске новизны, небольшого стресса. Лекция «У меня стресс? Что делать!?» Поведение типа А и типа Б Люди различаются  врожденными стратегиями реакции на стрессовые ситуации. Наиболее яркий пример — мужская и женская реакция на стресс. Если говорить в общем, то у женщин стратегия  — это минимизация проигрыша, а у мужчин — максимизация выигрыша. Это логично: большинство мужских особей в природе гибнут в конкурентной борьбе за лидерство и право оставить потомство, тогда как любая женская особь — исключительно ценна для вида, потому что прямо способствует его воспроизводству. Надо оговориться, что это очень общая характеристика и, конечно же, не может быть применима ко всем. Кроме того, выделяются еще две стратегии: активное противостояние стрессовой ситуации (атака или бегство) и пассивное, выжидательное поведение (затаивание или замирание). Первое называют стратегией типа А, второе — стратегией типа Б. В многочисленных опытах на мышах было выяснено, что склонность к тому или иному типу поведения — врожденный признак с высоким индексом наследования. Предполагается, что у людей такое разделение тоже есть, хотя вопрос этот еще не полностью изучен. Важно отметить, что если побуждать крысу типа Б к активным действиям, то у нее возникнут тревожные расстройства. Для типа А — наоборот, вынужденное ожидание вместо активных действий приведет к развитию депрессии. Лекция «У меня стресс? Что делать!?» Хронические стрессы и депрессивный синдром Всем известно, что самым вредным для здоровья является хронический стресс. Но откуда он берется? На самом деле, это следствие неконтролируемого стресса — такого, к которому невозможно приспособиться, от которого невозможно избавиться. И самое неприятное — невозможно разгадать причину его появления и предсказать момент его возникновения. Такой патогенный стресс приводит к депрессивному синдрому, который характеризуется подавленностью всех функций: моторных, когнитивных, функциональных. С начала 20 века происходит интенсивный рост депрессивных заболеваний. Почему это происходит, точно мы сказать не можем. Но, возможно, это связано с тем, что современное общество заточено на лидеров: нас окружает реклама активности и успеха. И для многих это становится очень тягостным. Появилось множество тренингов «личностного роста», развития лидерских качеств. Но, например, для людей со склонностью к поведению типа Б такие тренинги могут стать весьма травмирующим мероприятием. Как не дать плохому настроению превратиться в депрессию? Связь между плохим настроением и депрессией примерно такая же, как между бытовым пьянством и алкоголизмом. Если человек — алкоголик, ему может помочь только врач-нарколог. Если у человека депрессия, ему может помочь только психиатр или психотерапевт. Точно так же как увлекающийся алкоголем человек может волевым усилием или при помощи близких остановить свою пагубную привычку и не дать ей развиться в алкоголизм, так и в плохом настроении мы можем помочь себе сами. Лекция «У меня стресс? Что делать!?» Смещенная активность как противоядие от депрессии Если крысу подвергать болевому воздействию в таких условиях, где она не может избежать ударов током, у нее вырабатывается выученная беспомощность — это модель развития депрессии. Если двух крыс посадить так, что они будут иметь коммуникационное отверстие в перегородке, они будут драться — но депрессии у них не будет. Главный вывод из этого наблюдения такой: нужно иметь возможность переместить фокус внимания со стресса на что-то другое — тогда пережить его гораздо проще. Смещенная активность — это такая активность, которая не может удовлетворить актуальную потребность. Нечто вызвало у нас стресс, например, какие-то неприятности на работе. Мы не знаем, что предпринять, чтобы избавиться от этих неприятностей. Но мы можем заняться чем-нибудь другим. Какие самые распространенные формы смещенной активности у человека? Это, прежде всего, еда (хорошо известно, что многие стресс «заедают»), фанатичная уборка квартиры, а еще агрессивность и враждебность (например, когда человек начинает срываться на родных из-за проблем на работе). Так как у людей основные стрессы вызваны социальными стимулами, то смещенная активность, которая поможет скомпенсировать негативные воздействия стресса — это создание дополнительных сообществ, в которых мы будем успешны. Примеров можно привести массу: это всевозможные хобби и клубы по интересам, творчество, уход в религиозность, увлечение спортом или особыми диетами и так далее. Дмитрий Жуков Ученые выяснили, что справляться со стрессом хорошо помогают компьютерные игры. В исследовании людей разделили на две группы: обеим показывали неприятные изображения и фильмы, вызывающие отвращение. Но одной дали поиграть в тетрис, другой — в Эрудита, а третья, контрольная группа, не делала ничего. В итоге у тех, кто играл в тетрис, навязчивые воспоминания о неприятных кадрах исчезали гораздо быстрее. Вероятное объяснение этому такое: в любой игре, особенно такой простой, как тетрис, мы можем постоянно улучшать свои результаты, добиваться быстрого роста и успеха, что как бы компенсирует неудачи в других сферах жизни. Стресс-протекция Существуют и более простые, физиологические методы стресс-протекции. Хорошо известный факт: чтобы успокоить младенца, его надо укачать. Дело в том, что стимуляция вестибулярного аппарата очень благотворно действует на нервную систему. Причем неважно: будь то танцы, бег, ходьба или качание на качелях — все это работает на улучшение настроения. Самое плохое, что можно придумать — это лежать на диване и ждать, когда плохое настроение само пройдет. Еще один источник положительных эмоций — это рискованное поведение. Причем, такое поведение характерно не только для людей, но и для животных. Например, врановые птицы часто задирают и дразнят крупных хищников, например, собак. Никакого биологического смысла в этих действиях нет — чистое развлечение. Люди тоже испокон веков обожают аттракционы, карусели, горки, качели и так далее. Все это, как показывают многочисленные эксперименты и исследования, стимулирует выработку анксиолитических веществ, которые уменьшают тревогу. К началу","Открытая лекция, Главное, Стресс, Mental health month"
