Code,Title,Date,Views,Text,Tags
13476,ИТМО ― в мировом топ-100 и лучший в России в Шанхайском предметном рейтинге,"27 Октября 2023, 09:30",49502,"Кроме Automation & Control , Университет ИТМО ― лучший в России в категориях Nanoscience & Nanotechnology и Computer Science & Engineering , а в области Telecommunication Engineering ИТМО стал единственным российским участником. Еще в одной категории ― Materials Science & Engineering ― ИТМО вошел в тройку лучших среди российских университетов. «С 2009 года ИТМО развивает международную лабораторию мирового уровня в области систем автоматического управления и технической кибернетики ― это стало возможным в том числе благодаря мегагранту 2013 года и программе ""5-100"". Шанхайский рейтинг ― самый наукометричный и беспристрастный из существующих, в нем объективно оцениваются показатели исключительно научных достижений университетов. А фундамент таких достижений ― это прочное сообщество единомышленников. Поэтому нашей главной задачей в ИТМО было построить сеть прочных, качественных и доверительных научных связей с ведущими мировыми учеными. Это взаимодействие продолжается и сейчас. Мы создаем открытую площадку для научной работы ― ИТМО единственный вуз в России, у которого сразу два проекта в рамках ""Программы совместных институтов"" с ведущими китайскими вузами: университетом Ханчжоу Дяньцзы и Чанчуньским политехническим университетом», ― отметил директор мегафакультета компьютерных технологий и управления ИТМО Алексей Бобцов . Всего в рейтинге 55 предметов, которые объединены в пять укрупненных направлений: естественные науки, инженерные науки, науки о жизни, медицинские науки и социальные науки. В этом году составители проанализировали порядка 5000 вузов из 104 стран, около 1900 попали в список лучших университетов мира. Шанхайский предметный рейтинг строится на основании библиометрических показателей из базы данных Web of Science и аналитической платформы InCites. Вузы оцениваются по ряду критериев: число и цитируемость научных статей, представленных в ведущих научных журналах, международное соавторство, а также наличие престижных научных наград и премий у преподавателей и сотрудников вуза. С полными результатами Шанхайского глобального рейтинга по предметным областям и его методологией можно ознакомиться на сайте агентства. К началу","Главное, Рейтинги, Шанхайский рейтинг, Международные рейтинги, ГлавноеMain2, ГлавноеTop"
13435,Стартует седьмой сезон Всероссийской олимпиады «Я – профессионал»,"27 Сентября 2023, 15:29",26497,"Всероссийская олимпиада студентов «Я – профессионал» — один из флагманских проектов платформы «Россия — страна возможностей». Олимпиада проходит при поддержке Министерства науки и высшего образования РФ. Принять участие в соревнованиях могут студенты разных направлений подготовки: технических, гуманитарных, естественно-научных, педагогических, аграрных и медицинских. В этом году олимпиада включает десять групп направлений. Среди них ― «Компьютерные науки», «Инженерные науки и технологии», «Медицина и здравоохранение», «Искусство и гуманитарные науки» и другие. На олимпиаде проверяются теоретические знания и практические навыки студентов ― задания максимально приближены к реальным кейсам и составлены так, чтобы дать участникам возможность попробовать себя в будущей профессии. Вопросы разрабатывают эксперты ведущих вузов страны и крупнейших российских компаний. ИТМО ― один из вузов-организаторов олимпиады. В этом году университет курирует три трека: «Программирование и информационные технологии», «Робототехника», «Информационная и кибербезопасность». Генеральный партнер треков — Сбер. «ИТМО организует именно такие треки, потому что у нас большая экспертиза в этих областях: ИТМО ― семикратный чемпион мира по спортивному программированию, один лучших вузов России по IT и робототехнике в предметном рейтинге RAEX . Мы постарались сделать задания треков максимально практико-ориентированными и интересными для участников», — рассказали организаторы олимпиады от ИТМО. Участники олимпиады смогут не только посоревноваться в профессиональных компетенциях, но и посетить образовательные мероприятия, получить карьерные консультации и пройти стажировку в ведущих компаниях страны. Победители и медалисты олимпиады смогут поступить в ИТМО без вступительных испытаний. Медалисты также получат денежные призы в размере от 100 до 300 тысяч рублей. Регистрация на олимпиаду завершится 14 ноября. С 17 ноября по 3 декабря состоится отборочный этап, а с февраля по апрель 2024 года — заключительный этап. Итоги станут известны в мае. Также весной пройдут образовательные форумы, в частности — форум «Тебе решать!»  в ИТМО. Мероприятие включает лекции от экспертов университета и топовых компаний, мастер-классы, карьерные консультации, экскурсии в ведущие компании и кейс-чемпионат. Принять участие в олимпиаде могут студенты российских вузов, которые учатся в бакалавриате и магистратуре. Зарегистрироваться на олимпиаду и следить за новостями можно на сайте . Добавим, что ежегодно в олимпиаде участвуют и студенты ИТМО. Например, в VI сезоне соревнований магистрант первого курса Нового физтеха ИТМО Захар Яковлев поставил рекорд соревнований, выиграв сразу 8 медалей. К началу","Поступление, Олимпиады, Главное, Я — профессионал, Всероссийские олимпиады, ГлавноеBottom"
13432,Нейросеть научили вести профессиональный диалог: ИИ обучили на данных нефтяной компании,"26 Сентября 2023, 12:30",30822,"В основе цифрового корпоративного эксперта «Акела» — технология автоматизации дообучения больших языковых моделей — программ, которые в зависимости от контекста вопроса или фразы предсказывают наиболее вероятный ответ. Технология избавляет от необходимости размечать (систематизировать) исходные документы вручную, благодаря чему настройка языковой модели под различные профессиональные задачи проходит в разы быстрее. «Чтобы получить инструкцию по какому-либо бизнес-процессу, достаточно задать соответствующий запрос системе. Или, например, если срочно потребуется конкретная цифра или любые другие данные, не нужно вручную перебирать все документы — с этим буквально за несколько минут справится цифровой корпоративный эксперт. Также с его помощью можно проводить тестирование с валидацией ответов, то есть проверять знания специалистов по конкретным вопросам. Фактически система может легко общаться по всем направлениям компании, если есть документальная базы для обучения. В перспективе она сможет еще и находить ошибки и несоответствия в документах», — рассказал руководитель проекта, старший научный сотрудник Исследовательского центра «Сильный ИИ в промышленности» Денис Насонов . Денис Насонов. Фото: ITMO.NEWS Система обучена на более 500 нормативно-методических документах ПАО «Татнефть». Сейчас она заточена на решение задач по обеспечению техники безопасности, но разработчики планируют расширить функционал системы и дообучить его на других данных компании. «В будущем мы расширим функционал “Акелы” и будем применять систему для цифровизации накопленных знаний в единое семантическое пространство. Это качественный новый интеллектуальный инструмент для аналитики, который ускорит и автоматизирует производственные и корпоративные процессы в нашей компании», — отметил директор ООО «ТатИТнефть» Ильшат Карамов . («ТатИТнефть» — дочерняя компания ПАО «Татнефть», которая специализируется на разработке программного обеспечения и обслуживании систем в сфере информационных технологий). Система «Акела» была представлена на международном IT-форуме Kazan Digital Week — 2023. К началу","Искусственный интеллект, IT-технологии, Главное, Татнефть, ИИ в промышленности, ГлавноеBottom, Kazan Digital Week, IT-форумы"
13422,Nau Engine заключает стратегическое партнерство с ИТМО,"20 Сентября 2023, 14:00",24168,"Команда Nau Engine совместно с преподавателями Школы разработки видеоигр ИТМО планирует создание программ с использованием и тестированием нового игрового движка, которые будут доступны в формате самостоятельного образовательного курса. Взаимодействие разработчиков с преподавателями и студентами позволит не только отработать сам образовательный контент, но и создать методические рекомендации для интеграции нового движка в образовательные программы других вузов, а также для подготовки преподавателей для проведения тематических курсов. Студенты университета смогут одними из первых системно познакомиться со всеми особенностями движка, что повысит их конкурентоспособность на рынке труда. «ИТМО всегда ориентируется на запросы рынка — те, кто первыми осваивают новые инструменты, всегда задают тренд развития индустрии. “Перемешивание” ведущих специалистов отрасли, талантливых педагогов и студентов — это гарантия востребованности для выпускников. Кроме того, мы находим партнеров со схожими ценностями и стратегическим видением развития. В случае с Nau Engine это максимальная синергия» , — отметила Дарья Козлова , первый проректор ИТМО. Дарья Козлова. Фото: Дмитрий Григорьев / ITMO.NEWS В период с июня по сентябрь текущего года команда Nau Engine получила уже более 8 тысяч заявок от разработчиков на участие в бета-тестировании движка. Nau Engine разрабатывается на принципах открытого кода, будет обладать мощным ядром с удобным редактором и будет доступен для разработчиков любой квалификации. Движок также позволит быстро создавать игровые проекты; предоставит пользователям доступ к инструментам для интеграции с игровыми платформами и популярными сервисами; даст возможность создавать контентные обновления, сезоны, сообщества, лидерборды и другие метасистемы. «Команда Nau Engine состоит из таких же разработчиков, как и те, кто будут использовать движок на практике. Мы понимаем, насколько важно не просто создать движок, а сделать так, чтобы начать его использовать можно было максимально удобно и просто. И тут важную роль играет подготовка специалистов, доступность материалов и их адаптированность для разработчиков разного уровня подготовки. ИТМО, в свою очередь, является одним из ведущих вузов по подготовке ИТ-специалистов, поэтому мы считаем, что наше сотрудничество получится максимально продуктивным», — Александр Мясищев , директор проекта Nau Engine. Nau Engine. Источник: nauengine.org Партнерство ИТМО с Nau Engine — это продолжение развития образовательного блока ИТМО, связанного с игровой индустрией. В этом году ИТМО запустил программу бакалавриата « Технологии разработки компьютерных игр » — теперь вместе с одноименной магистратурой университет обеспечивает полный цикл подготовки специалистов, которые не только в совершенстве владеют фундаментальными знаниями, но и готовы создавать свои конкурентоспособные продукты для игрового рынка. Все возможности для студентов по обучению и поддержке студентов, которые хотят развиваться на рынке геймдева и разрабатывать свои игры, объединены в Школу разработки видеоигр Университета ИТМО. В феврале этого года было объявлено о старте работ по созданию российского игрового движка. Его производством занимается независимая команда, состоящая из экспертов в области разработки и представителей игрового сообщества. К реализации проекта планируется привлечь не менее 100 специалистов, включая программистов, технических писателей, технических художников и экспертов других профилей. К началу","Образование, Главное, Геймдев, Разработка игр, ГлавноеBottom, Nau Engine"
13396,Российские школьники выиграли четыре золота на международной олимпиаде по информатике,"4 Сентября 2023, 09:56",32819,"В олимпиаде участвовали два школьника из Казани — девятиклассник Гимран Абдуллин и одиннадцатиклассник Валерий Родионов — и два учащихся московских школ — одиннадцатиклассники Иван Пискарев и Антон Степанов. Все они до этого прошли национальный отбор и были победителями во Всероссийской олимпиаде для школьников. На IOI участники должны были решить и запрограммировать по три алгоритмические задачи в каждом из двух туров по пять часов. Например, в одном из заданий им нужно было написать программу для идентификации карты доступа к сейфам венгерского государственного казначейства. В другом — создать компьютерную модель для планирования хореографии танцевальной группы. Ребятам удалось показать отличный результат — каждый из них завоевал золотую медаль. Такой же высокий результат (четыре золота) лишь у школьников из Китая, США и Японии. « Получить четыре золота было очень непросто. После первого тура у Гимрана было 45 место ― середина серебра. Но он собрался, решил за первый час на полный балл задачу на втором туре и получил золото. Самый лучший результат в нашей команде у Ивана Пискарева, он тоже отличился во второй день, набрав максимальный среди всех участников балл по нестандартной задаче ― там необходимо было запрограммировать робота, который вслепую должен был построить кратчайший путь в неизвестном лабиринте», ― рассказал по итогам соревнований руководитель команды, доцент факультета информационных технологий и программирования ИТМО Андрей Станкевич . Международная олимпиада по информатике (IOI) проводится с 1989 года. В этом году соревнования принимал венгерский город Сегед. В прошлом году школьники из России повторили результат 2021 года и завоевали три золотые и одну серебряную медаль. Ранее все четыре школьника из России получали золото лишь четыре раза: в 2000, 2004, 2012 и 2019 годах. Всего за все время проведения олимпиады, с учетом IOI 2023, школьники из России выиграли 75 золотых, 41 серебряную и 12 бронзовых медалей. По количеству и статусу наград Россия занимает второе место. К началу","Информатика, Олимпиады, IOI, Главное, Международные олимпиады, ГлавноеBottom"
