Code,Title,Date,Views,Text,Tags
9320,Окно в мир: программисты Университета ИТМО создали приложение для борьбы с чувством одиночества во время пандемии,"8 Апреля 2020, 12:10",13168,"Глобальная пандемия коронавируса COVID-19 полностью изменила привычный уклад жизни миллиардов людей. Мы наблюдаем, как рушатся привычные социальные связи, сутками сидим дома, мало контактируя с внешним миром. Даже те, кто продолжает ходить на работу в это нелегкое время, не могут зайти в любимый бар или посидеть с друзьями в антикафе. Пытаясь найти применение свободному времени, кто-то начал учиться программированию, кто-то смотрит сериалы, а кто-то вышивает крестиком. Однако большинству это не позволяет справиться с чувством оторванности от других людей, не помогает в условиях острого дефицита общения. Каждому хочется знать, что они не одиноки и где-то есть человек, который переживает в эти дни сходные эмоции. Чтобы найти таких людей, программисты Университета ИТМО создали новое приложение HowWeSurvive . Карта приложения HowWeSurvive. Источник: howwesurvive.online « Я начал замечать, что в соцсетях люди все больше и больше пишут об одиночестве, тревоге, беспокойстве , — рассказывает один из создателей приложения, старший научный сотрудник Национального центра когнитивных разработок Александр Вишератин . — Многие люди не привыкли сидеть постоянно дома, это вызывает дискомфорт. Хотелось каким-то образом помочь людям в эти тяжелые времена, я начал думать над тем, как это можно сделать, и как-то вечером у меня появилась идея. Я решил, что, наверное, многие хотят посмотреть, как люди в других городах и даже странах живут на карантине. Так я решил сделать приложение ». В команду вошли два человека — Александр Вишератин и его коллега, фронтенд разработчица Университета ИТМО Юлия Федорова. Вся работа над приложением заняла около недели — важно было сделать так, чтобы приложение работало быстро и корректно, несмотря на общую перегруженность сетей во время пандемии. « Очень важно понимать, для кого создается та или иная визуализация, кто и как будет пользоваться результатами нашей работы , — рассказывает Юлия. — Мы упростили дизайн: интерфейс получился свободным и минималистичным, мы использовали минимальный набор инструментов для разработки, что позволяет использовать приложение даже при низком качестве интернет-соединения ». Команда проекта: Александр Вишератин и Юлия Федорова. Фото из личного архива #HowWeSurvive Само приложение представляет собой интерактивную карту мира, на которой отображаются посты в Instagram: фото и видео. Именно в карте и состоит главное отличие разработки петербуржцев от инструментов, которые уже существуют в соцсети — поиск идет не по теме, не по времени, а именно по географии записей, главное, чтобы автор включил геолокацию и поставил хештег #howwesurvive. « Пользователь может посмотреть, какие посты в Instagram публикуют люди в той или другой области, республике, регионе , — рассказывает Александр. — Пользователь может увеличить или уменьшить масштаб карты, в зависимости от этого он будет получать большую или меньшую детализацию по регионам. Можно навестись на Россию, отдельно на Санкт-Петербург или даже на отдельный район. Так можно смотреть, что выложили из дома на соседней улице ». Один из результатов, найденный по итогам просмотра карты приложения HowWeSurvive В принципе алгоритм сам ищет в Instagram посты с соответствующим хештегом, но этот процесс можно ускорить, если зайти на сайт приложения и вручную скинуть ссылку на свой пост. Тогда он практически моментально появится на карте. Смотреть посты можно даже не будучи зарегистрированными в Instagram. « Главный акцент мы сделали на ярких маркерах на карте, цвет которых варьируется на основании количества постов в области , — рассказывает Юлия. — При клике на точку открывается модальное окно, которое по внешнему виду похоже на ленту Instagram: пользователи могут легко в нем ориентироваться благодаря знакомому интерфейсу. Вообще я рада, что мы смогли создать приложение, которое отражает идею глобальной солидарности. Поразительно то, что мы все переживаем происходящие события очень похожим образом: при исследовании карты можно увидеть, что переживания людей со всех уголков мира удивительно схожи ». К началу","Приложение, Главное, Социальные сети, Общение, Инстаграм, Пандемия, COVID-19, HowWeSurvive"
9311,График работы и обучения Университета ИТМО с 4 апреля по 30 апреля,"3 Апреля 2020, 20:56",13482,"Организация обучения студентов и работы сотрудников В соответствии с распоряжением, обучение в Университете ИТМО продолжится с понедельника, 6 апреля, и будет реализовано исключительно с применением электронного обучения и дистанционных образовательных технологий. Проведение научной и иной деятельности обеспечивается с соблюдением мер по профилактике распространения новой коронавирусной инфекции (COVID-2019), а также преимущественно в дистанционном режиме работы. На такой формат работы университет переводит максимально возможное число работников. Мера действует также с 4 по 30 апреля 2020 года. При этом допускается сохранение недистанционного характера работы для тех сотрудников, чье присутствие на рабочем месте в Университете ИТМО является критически важным для обеспечения функционирования вуза, в том числе для обеспечения безопасности объектов его инфраструктуры. В эту категорию входят: ректор, проректоры, главный бухгалтер, начальник департамента информатизации, информационной безопасности режима, а также ряд других сотрудников. Работа всех сотрудников, которые не перейдут на дистанционный формат работы, будет организована в соответствии с соблюдением установленного санитарно-эпидемиологического режима. Фото: ITMO.NEWS Меры поддержки для студентов и сотрудников Университета ИТМО Кроме того, распоряжение устанавливает конкретные меры поддержки для студентов и сотрудников Университета ИТМО. Стипендиальная комиссия в дистанционном формате организует прием и оперативное рассмотрение заявлений на материальную поддержку от обучающихся, члены семей которых временно утратили доход в связи с введенными мерами, направленными на противодействие распространению новой коронавирусной инфекции (COVID-2019). Рассмотрение таких заявлений будет осуществляться не реже одного раза в месяц. Подробная информация будет опубликована на сайте ITMO.STUDENTS . Также, учитывая, что проведение занятий в дистанционном формате посредством ВКС-платформ, таких как ZOOM и других программ, более трудоемко, чем традиционное проведение занятий офлайн, университет обеспечит финансовое поощрение профессорско-преподавательского состава и иных сотрудников вуза, которые оперативно организовали работу в новых условиях дистанционного обучения. C полным текстом документа можно ознакомиться по ссылке . Добавим, что следить за всей актуальной информацией по эпидемиологической обстановке, связанной с распространением коронавирусной инфекции, можно на этой странице . Если у вас остались вопросы или есть предложения по поводу мер по предупреждению распространения нового коронавируса, пожалуйста, обращайтесь в студенческий офис (за актуальной информацией также можно следить в телеграм-канале ITMOLNIA ), а также в Департамент образовательной деятельности (для преподавателей). По вопросам организации научной деятельности просим обращаться по адресу finnich@itmo.ru . По вопросам обучения в аспирантуре и подготовки диссертаций — в отдел международной аспирантуры и докторантуры . По кадровым вопросам необходимо обращаться по адресу: hr@itmo.ru . К началу","Официально, Распоряжение, Главное, Студенты, График работы, Официальная информация, COVID-19, График обучения"
9296,Акселератор ИТМО совместно с компанией МТС запустил онлайн-программу для разработчиков 5G-решений,"31 Марта 2020, 10:28",12792,"Специалисты МТС будут проводить вебинары и онлайн-воркшопы для всех резидентов трека 5G Акселератора ИТМО уже с этой недели, но подать заявку можно вплоть до 10 апреля. Участники программы Центра 5G МТС получат доступ к рабочей зоне на ВДНХ с оборудованием, модули и телефоны для сетей нового поколения, а также экспертную поддержку специалистов МТС. У стартапов будет площадка для разработки и испытаний решений в сети 5G, облачные сервисы Cloud MTS, рабочие места, абонентское оборудование, модули и демонстрационная зона. Представители лучших команд смогут претендовать на грант до 500 тысяч рублей от МТС. Программа для разработчиков инновационных 5G-решений от Акселератора ИТМО Программа нацелена на то, чтобы улучшить знания стартаперов в сфере 5G и способствовать созданию продуктов на базе сетей нового поколения. Компания МТС даст возможность предпринимателям подготовить и усовершенствовать свои технологические продукты к моменту запуска сети 5G в коммерческое использование в России. « МТС стал партнером Акселератора ИТМО, потому что мы уверены: для успешного развития 5G в России необходим альянс между технологическими компаниями, стартапами и вузами. ИТМО является одним из ведущих вузов Санкт-Петербурга в сфере работы с молодыми технологическими компаниями. Специалисты МТС начнут работу с гипотезами участников акселератора еще до того, как те станут резидентами Центра 5G МТС, чтобы помочь стартаперам быстрее найти полезное применение технологии пятого поколения связи », — рассказал руководитель Центра 5G МТС Денис Панасенко . Центр 5G МТС. Источник: plus.rbc.ru Трек по 5G включает в себя шесть основных направлений: иммерсивные сервисы с AR/VR/MR, игры, производство и стриминг UHD контента, eHealth, автоматизацию промышленных предприятий, а также широкий спектр решений для умного города. Каждая команда выбирает свою категорию, в которой она будет создавать продукт. « Наше сотрудничество направлено на развитие предпринимательства и технологий 5G в Санкт-Петербурге. Сегодня 5G — это перспективная технология, которую еще предстоит внедрить во все сферы нашей жизни », — сообщил начальник Акселератора ИТМО Алексей Соломатин . Алексей Соломатин. Фото: ITMO.NEWS В программу принимаются проекты на любом этапе готовности, даже на стадии идеи. Стартаперы пройдут семь основных образовательных модулей: Продажи в b2b и b2c, Секреты качественного проблемного интервью, Переориентация бизнеса на 5G, Маркетинг без бюджета: лучшие digital-практики, Работа с возражениями, PR стартапа, Юридические тонкости. Кроме общей программы, каждый стартап будет сопровождать персональный наставник. « Взаимодействие университета и реального сектора экономики — это важная составляющая развития любого вуза. Наладить конструктивный диалог между представителями научной среды и бизнесом — это всегда непростая задача и вызов. Но, благодаря тому, что с обеих сторон работает группа профессионалов, то процесс запущен и мы уверены, в будущем он принесет плодотворные результаты всем участникам программы », — рассказал директор Технопарка ИТМО Александр Колоусов . Для того, чтобы принять участие членам команды нужно всего лишь заполнить форму на сайте программы и дождаться рассмотрения заявки. К началу","Акселератор, Технологии, Сотрудничество, Программа, 5G, Стартапы, Главное, Образовательная программа, МТС, Cloud MTS, AR/VR/MR"
9291,STAY HOME > GO ONLINE: переходим в онлайн по-петербургски,"29 Марта 2020, 20:28",10061,"Источник: ИТМО Источник: ИТМО Источник: ИТМО Источник: ИТМО Источник: ИТМО Добавим, что самые важные рекомендации о том, почему сегодня необходимо беречь себя и не паниковать, мы собрали для вас здесь , призвав на помощь котиков. Устанавливайте от них же удобный стикерпак « НЕпаникотики », продолжайте общаться онлайн и не скучайте дома! К началу","Главное, Открытки, Коронавирус, Онлайн, Лучше дома, GO ONLINE"
9287,График работы и обучения Университета ИТМО с 28 марта по 5 апреля,"26 Марта 2020, 18:59",10739,"« Предоставить обучающимся по реализуемым Университетом ИТМО образовательным программам каникулы с 28 марта 2020 г. по 5 апреля 2020 г. и проинформировать работников и обучающихся Университета ИТМО о соответствующих изменениях календарного учебного графика. Объявить, что дни с 30 марта 2020 г. по 3 апреля 2020 г. установлены Президентом Российской Федерации нерабочими днями с сохранением за работниками заработной платы », — говорится в распоряжении (с полным текстом документа можно ознакомиться по ссылке ). Добавим, что ранее в соответствии с приказом ректора Университета ИТМО от 16 марта 2020 года №255-од «Об организации образовательной деятельности в условиях предупреждения распространения новой коронавирусной инфекции (COVID-2019) среди сотрудников и обучающихся» в петербургском университете уже была обеспечена реализация образовательных программ в полном объеме с применением электронного обучения и дистанционных образовательных технологий. Также Университет ИТМО принял ряд других мер по предупреждению распространения новой коронавирусной инфекции. С подробной информацией можно ознакомиться в этом материале . Напоминаем, что следить за всей актуальной информацией по эпидемиологической обстановке, связанной с распространением коронавирусной инфекции, можно на этой странице . Если у вас остались вопросы или есть предложения по поводу мер по предупреждению распространения нового коронавируса, пожалуйста, обращайтесь в студенческий офис (за актуальной информацией также можно следить в телеграм-канале ITMOLNIA ), а также в Департамент образовательной деятельности (для преподавателей). По кадровым вопросам просим обращаться по адресу: hr@itmo.ru . К началу","Официально, Обучение, Главное, Образовательный процесс, Официальная информация, Эпидемиологическая обстановка"
